{
  "$schema": "catalog.schema.json",
  "schemaVersion": 1,
  "customMonikerGuid": "cb4a8fc6-efe7-424a-b611-23adf22b568e",
  "customImages": [
    {
      "name": "dart",
      "id": 0,
      "file": "dart.png",
      "provenance": "legacy-unverified",
      "size": 32
    },
    {
      "name": "clojure",
      "id": 1,
      "file": "clojure.png",
      "provenance": "legacy-unverified",
      "size": 32
    },
    {
      "name": "apache",
      "id": 2,
      "file": "apache.png",
      "provenance": "legacy-unverified",
      "width": 33,
      "height": 32
    },
    {
      "name": "babel",
      "id": 3,
      "file": "babel.png",
      "provenance": "legacy-unverified",
      "size": 32
    },
    {
      "name": "csslint",
      "id": 4,
      "file": "csslint.png",
      "provenance": "legacy-unverified",
      "size": 32
    },
    {
      "name": "d",
      "id": 5,
      "file": "d.png",
      "provenance": "legacy-unverified",
      "size": 32
    },
    {
      "name": "editorconfig",
      "id": 6,
      "file": "editorconfig.png",
      "provenance": "legacy-unverified",
      "size": 32
    },
    {
      "name": "ejs",
      "id": 7,
      "file": "ejs.png",
      "provenance": "legacy-unverified",
      "width": 31,
      "height": 32
    },
    {
      "name": "elixir",
      "id": 8,
      "file": "elixir.png",
      "provenance": "legacy-unverified",
      "size": 32
    },
    {
      "name": "elm",
      "id": 9,
      "file": "elm.png",
      "provenance": "legacy-unverified",
      "size": 32
    },
    {
      "name": "erb",
      "id": 10,
      "file": "erb.png",
      "provenance": "legacy-unverified",
      "size": 32
    },
    {
      "name": "erlang",
      "id": 11,
      "file": "erlang.png",
      "provenance": "legacy-unverified",
      "size": 32
    },
    {
      "name": "eslint",
      "id": 12,
      "file": "eslint.png",
      "provenance": "legacy-unverified",
      "size": 32
    },
    {
      "name": "flash",
      "id": 13,
      "file": "flash.png",
      "provenance": "legacy-unverified",
      "size": 32
    },
    {
      "name": "go",
      "id": 14,
      "file": "go.png",
      "provenance": "legacy-unverified",
      "size": 32
    },
    {
      "name": "groovy",
      "id": 15,
      "file": "groovy.png",
      "provenance": "legacy-unverified",
      "size": 32
    },
    {
      "name": "haml",
      "id": 16,
      "file": "haml.png",
      "provenance": "legacy-unverified",
      "size": 32
    },
    {
      "name": "handlebars",
      "id": 17,
      "file": "handlebars.png",
      "provenance": "legacy-unverified",
      "size": 32
    },
    {
      "name": "haskell",
      "id": 18,
      "file": "haskell.png",
      "provenance": "legacy-unverified",
      "size": 32
    },
    {
      "name": "jade",
      "id": 19,
      "file": "jade.png",
      "provenance": "legacy-unverified",
      "size": 32
    },
    {
      "name": "jshint",
      "id": 20,
      "file": "jshint.png",
      "provenance": "legacy-unverified",
      "size": 32
    },
    {
      "name": "julia",
      "id": 21,
      "file": "julia.png",
      "provenance": "legacy-unverified",
      "size": 32
    },
    {
      "name": "lisp",
      "id": 22,
      "file": "lisp.png",
      "provenance": "legacy-unverified",
      "size": 32
    },
    {
      "name": "lua",
      "id": 23,
      "file": "lua.png",
      "provenance": "legacy-unverified",
      "size": 32
    },
    {
      "name": "mustache",
      "id": 24,
      "file": "mustache.png",
      "provenance": "legacy-unverified",
      "size": 32
    },
    {
      "name": "nunjucks",
      "id": 25,
      "file": "nunjucks.png",
      "provenance": "legacy-unverified",
      "size": 32
    },
    {
      "name": "perl",
      "id": 26,
      "file": "perl.png",
      "provenance": "legacy-unverified",
      "size": 32
    },
    {
      "name": "photoshop",
      "id": 27,
      "file": "photoshop.png",
      "provenance": "legacy-unverified",
      "size": 32
    },
    {
      "name": "puppet",
      "id": 28,
      "file": "puppet.png",
      "provenance": "legacy-unverified",
      "size": 32
    },
    {
      "name": "r",
      "id": 29,
      "file": "r.png",
      "provenance": "legacy-unverified",
      "size": 32
    },
    {
      "name": "rust",
      "id": 30,
      "file": "rust.png",
      "provenance": "legacy-unverified",
      "size": 32
    },
    {
      "name": "smarty",
      "id": 31,
      "file": "smarty.png",
      "provenance": "legacy-unverified",
      "size": 32
    },
    {
      "name": "sqlite",
      "id": 32,
      "file": "sqlite.png",
      "provenance": "legacy-unverified",
      "size": 32
    },
    {
      "name": "stylelint",
      "id": 33,
      "file": "stylelint.png",
      "provenance": "legacy-unverified",
      "size": 32
    },
    {
      "name": "swift",
      "id": 34,
      "file": "swift.png",
      "provenance": "legacy-unverified",
      "size": 32
    },
    {
      "name": "vue",
      "id": 35,
      "file": "vue.png",
      "provenance": "legacy-unverified",
      "size": 50
    },
    {
      "name": "zip",
      "id": 36,
      "file": "zip.png",
      "provenance": "legacy-unverified",
      "size": 32
    },
    {
      "name": "gradle",
      "id": 37,
      "file": "gradle.png",
      "provenance": "legacy-unverified",
      "size": 32
    },
    {
      "name": "pdf",
      "id": 38,
      "file": "pdf.png",
      "provenance": "legacy-unverified",
      "size": 32
    },
    {
      "name": "latex",
      "id": 39,
      "file": "latex.png",
      "provenance": "legacy-unverified",
      "size": 32
    },
    {
      "name": "matlab",
      "id": 40,
      "file": "matlab.png",
      "provenance": "legacy-unverified",
      "size": 32
    },
    {
      "name": "paket",
      "id": 41,
      "file": "paket.png",
      "provenance": "legacy-unverified",
      "size": 32
    },
    {
      "name": "yarn",
      "id": 42,
      "file": "yarn.png",
      "provenance": "legacy-unverified",
      "size": 32
    },
    {
      "name": "scala",
      "id": 43,
      "file": "scala.png",
      "provenance": "legacy-unverified",
      "size": 32
    },
    {
      "name": "scheme",
      "id": 44,
      "file": "scheme.png",
      "provenance": "legacy-unverified",
      "size": 32
    },
    {
      "name": "balsamiq",
      "id": 45,
      "file": "balsamiq.png",
      "provenance": "legacy-unverified",
      "size": 32
    },
    {
      "name": "semanticweb",
      "id": 47,
      "file": "semanticweb.png",
      "provenance": "legacy-unverified",
      "width": 32,
      "height": 33
    },
    {
      "name": "delphi",
      "id": 48,
      "file": "delphi.png",
      "provenance": "legacy-unverified",
      "size": 32
    },
    {
      "name": "qt",
      "id": 49,
      "file": "qt.png",
      "provenance": "legacy-unverified",
      "size": 32
    },
    {
      "name": "actionscript",
      "id": 50,
      "file": "actionscript.png",
      "provenance": "legacy-unverified",
      "size": 32
    },
    {
      "name": "ansible",
      "id": 51,
      "file": "ansible.png",
      "provenance": "legacy-unverified",
      "size": 32
    },
    {
      "name": "apigee",
      "id": 52,
      "file": "apigee.png",
      "provenance": "legacy-unverified",
      "width": 31,
      "height": 32
    },
    {
      "name": "applescript",
      "id": 53,
      "file": "applescript.png",
      "provenance": "legacy-unverified",
      "size": 32
    },
    {
      "name": "cobol",
      "id": 54,
      "file": "cobol.png",
      "provenance": "legacy-unverified",
      "size": 32
    },
    {
      "name": "coldfusion",
      "id": 55,
      "file": "coldfusion.png",
      "provenance": "legacy-unverified",
      "size": 32
    },
    {
      "name": "flow",
      "id": 56,
      "file": "flow.png",
      "provenance": "legacy-unverified",
      "size": 32
    },
    {
      "name": "haxe",
      "id": 57,
      "file": "haxe.png",
      "provenance": "legacy-unverified",
      "size": 32
    },
    {
      "name": "lime",
      "id": 59,
      "file": "lime.png",
      "provenance": "legacy-unverified",
      "size": 32
    },
    {
      "name": "fortran",
      "id": 61,
      "file": "fortran.png",
      "provenance": "legacy-unverified",
      "size": 32
    },
    {
      "name": "marko",
      "id": 62,
      "file": "marko.png",
      "provenance": "legacy-unverified",
      "size": 32
    },
    {
      "name": "nim",
      "id": 63,
      "file": "nim.png",
      "provenance": "legacy-unverified",
      "size": 32
    },
    {
      "name": "ocaml",
      "id": 64,
      "file": "ocaml.png",
      "provenance": "legacy-unverified",
      "size": 32
    },
    {
      "name": "patch",
      "id": 65,
      "file": "patch.png",
      "provenance": "legacy-unverified",
      "size": 32
    },
    {
      "name": "poedit",
      "id": 66,
      "file": "poedit.png",
      "provenance": "legacy-unverified",
      "size": 32
    },
    {
      "name": "plantuml",
      "id": 67,
      "file": "plantuml.png",
      "provenance": "legacy-unverified",
      "size": 32
    },
    {
      "name": "procfile",
      "id": 68,
      "file": "procfile.png",
      "provenance": "legacy-unverified",
      "size": 32
    },
    {
      "name": "raml",
      "id": 69,
      "file": "raml.png",
      "provenance": "legacy-unverified",
      "size": 32
    },
    {
      "name": "riot",
      "id": 70,
      "file": "riot.png",
      "provenance": "legacy-unverified",
      "size": 32
    },
    {
      "name": "twig",
      "id": 71,
      "file": "twig.png",
      "provenance": "legacy-unverified",
      "size": 32
    },
    {
      "name": "volt",
      "id": 72,
      "file": "volt.png",
      "provenance": "legacy-unverified",
      "size": 32
    },
    {
      "name": "neo4j",
      "id": 73,
      "file": "neo4j.png",
      "provenance": "legacy-unverified",